{
  "@type": "KnowledgeGraph",
  "generator": "build-graph.sh (MIF-native; SPEC §6c)",
  "nodes": [
    {
      "id": "urn:mif:c41cb16c-de00-557c-8af0-117044c0d809",
      "kind": "concept",
      "label": "Kafka adoption reduces coupling between services",
      "dimension": "technical"
    },
    {
      "id": "urn:mif:entity:technology:kafka",
      "kind": "entity",
      "label": "Kafka",
      "entityType": "technology"
    }
  ],
  "edges": [
    {
      "source": "urn:mif:c41cb16c-de00-557c-8af0-117044c0d809",
      "target": "urn:mif:entity:technology:kafka",
      "type": "mentions",
      "strength": null,
      "via": "entity"
    }
  ]
}
