{
  "@type": "KnowledgeGraph",
  "generator": "build-graph.sh (MIF-native; SPEC §6c)",
  "nodes": [
    {
      "id": "urn:mif:57acc61b-a5a8-5932-ae35-745a60ee2a2f",
      "kind": "concept",
      "label": "Local preprocessing lowers upstream bandwidth demand",
      "dimension": "technical"
    },
    {
      "id": "urn:mif:85700f43-7a90-58a5-99bb-42b60f569e99",
      "kind": "concept",
      "label": "Edge compute reduces round-trip latency for local inference",
      "dimension": "technical"
    },
    {
      "id": "urn:mif:b354d7c3-1d8e-5ab0-a0dc-f7d5b0c543ca",
      "kind": "concept",
      "label": "An edge gateway is the consolidation point for local compute and uplink",
      "dimension": "technical"
    },
    {
      "id": "urn:mif:entity:concept:bandwidth",
      "kind": "entity",
      "label": "bandwidth",
      "entityType": "Concept"
    },
    {
      "id": "urn:mif:entity:concept:edge-compute",
      "kind": "entity",
      "label": "edge compute",
      "entityType": "Concept"
    },
    {
      "id": "urn:mif:entity:concept:latency",
      "kind": "entity",
      "label": "latency",
      "entityType": "Concept"
    },
    {
      "id": "urn:mif:entity:technology:edge-gateway",
      "kind": "entity",
      "label": "edge gateway",
      "entityType": "Technology"
    }
  ],
  "edges": [
    {
      "source": "urn:mif:57acc61b-a5a8-5932-ae35-745a60ee2a2f",
      "target": "urn:mif:b354d7c3-1d8e-5ab0-a0dc-f7d5b0c543ca",
      "type": "supports",
      "strength": 0.7,
      "via": "relationship"
    },
    {
      "source": "urn:mif:85700f43-7a90-58a5-99bb-42b60f569e99",
      "target": "urn:mif:b354d7c3-1d8e-5ab0-a0dc-f7d5b0c543ca",
      "type": "supports",
      "strength": 0.8,
      "via": "relationship"
    },
    {
      "source": "urn:mif:b354d7c3-1d8e-5ab0-a0dc-f7d5b0c543ca",
      "target": "urn:mif:85700f43-7a90-58a5-99bb-42b60f569e99",
      "type": "derived-from",
      "strength": 0.8,
      "via": "relationship"
    },
    {
      "source": "urn:mif:b354d7c3-1d8e-5ab0-a0dc-f7d5b0c543ca",
      "target": "urn:mif:57acc61b-a5a8-5932-ae35-745a60ee2a2f",
      "type": "derived-from",
      "strength": 0.7,
      "via": "relationship"
    },
    {
      "source": "urn:mif:57acc61b-a5a8-5932-ae35-745a60ee2a2f",
      "target": "urn:mif:entity:concept:edge-compute",
      "type": "mentions",
      "strength": null,
      "via": "entity"
    },
    {
      "source": "urn:mif:57acc61b-a5a8-5932-ae35-745a60ee2a2f",
      "target": "urn:mif:entity:concept:bandwidth",
      "type": "mentions",
      "strength": null,
      "via": "entity"
    },
    {
      "source": "urn:mif:85700f43-7a90-58a5-99bb-42b60f569e99",
      "target": "urn:mif:entity:concept:edge-compute",
      "type": "mentions",
      "strength": null,
      "via": "entity"
    },
    {
      "source": "urn:mif:85700f43-7a90-58a5-99bb-42b60f569e99",
      "target": "urn:mif:entity:concept:latency",
      "type": "mentions",
      "strength": null,
      "via": "entity"
    },
    {
      "source": "urn:mif:b354d7c3-1d8e-5ab0-a0dc-f7d5b0c543ca",
      "target": "urn:mif:entity:technology:edge-gateway",
      "type": "mentions",
      "strength": null,
      "via": "entity"
    },
    {
      "source": "urn:mif:b354d7c3-1d8e-5ab0-a0dc-f7d5b0c543ca",
      "target": "urn:mif:entity:concept:edge-compute",
      "type": "mentions",
      "strength": null,
      "via": "entity"
    }
  ]
}
